number,question,answer,机器回答通过与否,原因及正确解答,满意度
1,1。计算 5/12+1/12=  3/7+4/7= 7/6+7/6=  9/25+6/25= 3/8+3/8= 3/10+1/10= 10/33+1/33= 15/16+9/16=,计算结果如下：5/12 + 1/12 = 6/12 = 1/2 3/7 + 4/7 = 7/7 = 1 7/6 + 7/6 = 14/6 = 7/3 9/25 + 6/25 = 15/25 = 3/5 3/8 + 3/8 = 6/8 = 3/4 3/10 + 1/10 = 4/10 = 2/5 10/33 + 1/33 = 11/33 15/16 + 9/16 = 24/16 = 3/2,否,10/33 + 1/33 = 11/33 =1/3,0
2,3/7-3/7= 14/15-4/15= 9/10-7/10= 11/14-5/14= 5/8-1/8= 7/6-1/6= 17/18-5/18= 19/20-7/20=,计算结果如下：3/7 - 3/7 = 0 14/15 - 4/15 = 10/15 = 2/3 9/10 - 7/10 = 2/10 = 1/5 11/14 - 5/14 = 6/14 = 3/7 5/8 - 1/8 = 4/8 = 1/2 7/6 - 1/6 = 6/6 = 1 17/18 - 5/18 = 12/18 = 2/3 19/20 - 7/20 = 12/20 = 3/5,通过,,8
3,填空 1/13+7/13= 5/7-2/7= 7/17+8/17 ()-1/12=11/12 7/5+()=13/5 7/5-()=3/5,填空结果如下：1/13 + 7/13 = 8/13 5/7 - 2/7 = 3/7 7/17 + 8/17 = 15/17 ( ) - 1/12 = 11/12，所以空格内填入的是 12/12 或者 17/5 + ( ) = 13/5，所以空格内填入的是 6/5 或者 1/5 7/5 - ( ) = 3/5，所以空格内填入的是 4/5,否,17/5 + ( ) = 13/5，所以空格内填入的是 6/5,0
4,"下面哪些答案是1/2,那些答案是2/3,请找出来。1/4+1/4 7/8-3/8 5/16+3/16 7/12+1/12 8/9-2/9 14/15-4/15 7/18+5/18 17/12-11/12",根据等式的性质，我们可以得出以下结论：1/4 + 1/4 = 2/4 = 1/2 7/8 - 3/8 = 4/8 = 1/2 5/16 + 3/16 = 8/16 = 1/2 7/12 + 1/12 = 8/12 = 2/3 8/9 - 2/9 = 6/9 = 2/3 14/15 - 4/15 = 10/15 = 2/3 7/18 + 5/18 = 12/18 = 2/3 17/12 - 11/12 = 6/12 = 1/2 所以，答案中是1/2的有：1/4+1/4、7/8-3/8、5/16+3/16、17/12-11/12；答案中是2/3的有：7/12+1/12、8/9-2/9、14/15-4/15、7/18+5/18,通过,,8
5,新风小学各年级学生人数分布情况如下。一年级占2/15，二年级占2/15，三年级占2/15，四年级占3/15，五年级占3/15，(1)六年级学生人数占几分之几？(2)一、二年级学生人数共占几分之几？(3)你还能提出其他问题并解答吗？,根据已知信息，各年级学生人数分布情况如下：一年级：2/15 二年级：2/15 三年级：2/15 四年级：3/15 五年级：3/15 (1) 六年级学生人数占几分之几？根据已知情况，我们可以计算出六年级学生人数占总人数的比例：六年级：15/15 - (2/15 + 2/15 + 2/15 + 3/15 + 3/15) = 3/15 所以，六年级学生人数占3/15。(2) 一、二年级学生人数共占几分之几？根据已知情况，我们可以计算出一、二年级学生人数占总人数的比例：一、二年级：2/15 + 2/15 = 4/15 所以，一、二年级学生人数共占4/15。(3) 其他问题：- 三、四、五年级学生人数共占几分之几？根据已知情况，我们可以计算出三、四、五年级学生人数占总人数的比例：三、四、五年级：2/15 + 3/15 + 3/15 = 8/15 所以，三、四、五年级学生人数共占8/15。,通过,,8
6,计算。1/9+5/9+2/9 6/11+3/11+1/11 1/4+1/4+3/4 7/10-1/10-3/10 11/6-7/6-1/6 1-2/3-1/3,根据等式的性质，我们可以计算以下结果：1/9 + 5/9 + 2/9 = 8/9 6/11 + 3/11 + 1/11 = 10/11 1/4 + 1/4 + 3/4 = 5/4 = 1 1/4 7/10 - 1/10 - 3/10 = 3/10 11/6 - 7/6 - 1/6 = 3/6 = 1/2 1 - 2/3 - 1/3 = 1/3 所以，计算结果为：1/9 + 5/9 + 2/9 = 8/9 6/11 + 3/11 + 1/11 = 10/11 1/4 + 1/4 + 3/4 = 1 1/4 7/10 - 1/10 - 3/10 = 3/10 11/6 - 7/6 - 1/6 = 1/2 1 - 2/3 - 1/3 = 1/3,否,1/4 + 1/4 + 3/4 = 5/4,0
7,春蕾小学图书馆中各类图书情况如右图。自然科学类占2/11，社会科学类占3/11，文艺类占5/11 (1)社会科学、自然科学和文艺类图书共占图书总量的几分之几？(2)其他图书占图书总量的几分之几？,根据提供的信息，我们可以计算以下结果：(1) 社会科学、自然科学和文艺类图书共占图书总量的比例：自然科学类占比：2/11 社会科学类占比：3/11 文艺类占比：5/11 总体占比：2/11 + 3/11 + 5/11 = 10/11所以，社会科学、自然科学和文艺类图书共占图书总量的比例为10/11。(2) 其他图书占图书总量的比例：其他图书占比：1 - 10/11 = 1/11 所以，其他图书占图书总量的比例为1/11。所以，根据提供的信息：(1) 社会科学、自然科学和文艺类图书共占图书总量的比例为10/11。(2) 其他图书占图书总量的比例为1/11。,通过,,8
8,在（）里填上“>”“<”或“=”。4/5-2/5（）9/10-7/10 5/8-3/8（）3/4-1/4 1-3/14-4/14（）3/20+8/20  3/12+5/12（）1/6+3/6   3/7+4/7（）4/11+7/11   2/3+5/3+2/3（）3+1/3,在（）里填上“>”“<”或“=”。4/5-2/5（=）9/10-7/10 5/8-3/8（=）3/4-1/4  1-3/14-4/14（<）3/20+8/20  3/12+5/12（=）1/6+3/6   3/7+4/7（=）4/11+7/11   2/3+5/3+2/3（>）3+1/3,否,4/5-2/5（>）9/10-7/10 5/8-3/8（<）3/4-1/4  2/3+5/3+2/3（<）3+1/3,0
9,用分母相同的分数组成算式并计算。1/14 1 3/4 3/9 4/5 2/5 2/9 4/9 1/5 1/9 7/9 1/6 7/6 5/6,将分母相同的分数组成算式并计算：1/14 + 1/14 = 2/14 = 1/7 3/4 + 1/4 = 4/4 = 1 3/9 + 2/9 = 5/9 4/5 + 1/5 = 5/5 = 1 2/5 + 2/5 = 4/5 2/9 + 4/9 = 6/9 = 2/3 1/5 + 1/5 = 2/5 1/9 + 1/9 = 2/9 7/9 + 2/9 = 9/9 = 1 1/6 + 7/6 = 8/6 = 4/3 5/6 + 1/6 = 6/6 = 1 请注意，这只是将分母相同的分数进行计算，结果可能需要进行约分。,通过,,8
10,算法接龙 3/4-/14 并根据得出的答案提出一个有带分母的加减,3/4 - 1/4 = 2/4 = 1/2 根据得出的答案 1/2，可以提出一个有带分母的加减算式：1/2 + 2/3 - 1/6 = ?,通过,,8
11,"有红，黄，置三条丝带。红丝带比黄丝带长7/20m,蓝丝带比黄丝带短品3/20m.红丝带与蓝丝带相差多少米？",红丝带比黄丝带长7/20m，蓝丝带比黄丝带短3/20m。红丝带与蓝丝带的长度差为：7/20 - 3/20 = 4/20 = 1/5 所以，红丝带与蓝丝带的长度差为1/5米。,否,7/20 + 3/20 = 10/20 = 1/2 所以，红丝带与蓝丝带的长度差为1/2米。,0
