question,answer,机器回答通过与否,满意度
0.86*7 3.3*16 12.8*42 0.19*40分别是多少？,好的，让我来帮你计算一下：0.86 * 7 = 6.02 3.3 * 16 = 52.8 12.8 * 42 = 537.6 0.19 * 40 = 7.6 所以，计算结果分别是：0.86 * 7 = 6.02 3.3 * 16 = 52.8 12.8 * 42 = 537.6 0.19 * 40 = 7.6,通过,8
假设我们有语文，数学，科学，美术及音乐5种课本，每个课本的单价分别为1，2，3，4及5元。这些教科书各买5本各需要多少钱？12本呢？23本呢？,好的，让我来计算一下：如果每个课本买5本，那么总共需要的钱数为：语文课本：1元/本 * 5本 = 5元 数学课本：2元/本 * 5本 = 10元 科学课本：3元/本 * 5本 = 15元 美术课本：4元/本 * 5本 = 20元 音乐课本：5元/本 * 5本 = 25元 所以，如果每个课本买5本，总共需要的钱数为：5元 + 10元 + 15元 + 20元 + 25元 = 75元。如果每个课本买12本，那么总共需要的钱数为：语文课本：1元/本 * 12本 = 12元 数学课本：2元/本 * 12本 = 24元 科学课本：3元/本 * 12本 = 36元 美术课本：4元/本 * 12本 = 48元 音乐课本：5元/本 * 12本 = 60元 所以，如果每个课本买12本，总共需要的钱数为：12元 + 24元 + 36元 + 48元 + 60元 = 180元。如果每个课本买23本，那么总共需要的钱数为：语文课本：1元/本 * 23本 = 23元 数学课本：2元/本 * 23本 = 46元 科学课本：3元/本 * 23本 = 69元 美术课本：4元/本 * 23本 = 92元 音乐课本：5元/本 * 23本 = 115元 所以，如果每个课本买23本，总共需要的钱数为：23元 + 46元 + 69元 + 92元 + 115元 = 345元。 所以，买5本需要75元，买12本需要180元，买23本需要345元。,通过,8
小亮家到学校大约1.3km 他每天往返两次 他每天走多少千米？他周一到周五共走多少千米？,小亮每天往返两次，也就是说他一天要走1.3km * 2 = 2.6km。小亮周一到周五共走的距离为2.6km * 5 = 13km。所以，小亮每天走2.6km，周一到周五共走13km。,通过,8
计算出两个因数的积 因数1分别为32 320 32 3.2 32 32 0.32 因数2分别为15 15 150 15 1.5 0.15 15 两两相乘 求积,让我们来计算一下这些因数的积：32 * 15 = 480 320 * 15 = 4800 32 * 150 = 4800 3.2 * 15 = 48 32 * 1.5 = 48 32 * 0.15 = 4.8 0.32 * 15 = 4.8 32 * 0.15 = 4.8 所以，这些因数的积依次为：480、4800、4800、48、48、4.8、4.8、4.8。,通过,8
要下雨了 小莉看见远处有闪电 4秒后听到了雷声 闪电的地方离小莉有多远？雷声在空气中的传播速度约是0.34千米/秒,根据给出的信息，我们可以使用声音的传播速度来计算闪电的距离。由于声音的传播速度约为0.34千米/秒，而小莉听到雷声的时间是闪电后的4秒，所以我们可以计算出雷声在空气中传播的距离为0.34千米/秒 * 4秒 = 1.36千米。因此，闪电的地方离小莉约有1.36千米的距离。,通过,8
算法妈妈的小红去买风筝 风筝有四种 分别为红色8.6元 黄色9.5元 蓝色6.8元及粉色14.2元 如果小红买了红色风筝1只 蓝色风筝2只 一共需要多少钱？,小红购买了1只红色风筝和2只蓝色风筝，让我们来计算一下总共需要多少钱：红色风筝的价格是8.6元，小红购买了1只，所以红色风筝的总价为8.6元 * 1只 = 8.6元。蓝色风筝的价格是6.8元，小红购买了2只，所以蓝色风筝的总价为6.8元 * 2只 = 13.6元。因此，小红购买这些风筝的总共需要的钱是8.6元 + 13.6元 = 22.2元。,通过,8
帮我计算下面各题 12.4 * 7, 2.3*12, 2.06*6, 3.13*53 谢谢,86.8 27.6 12.3 165.89,通过,8