question,answer
损失函数和性能指标分别服务于什么目的？,在训练过程中使用损失函数来优化模型的参数；而使用性能指标来评估训练后的模型。
在为特定任务选择损失函数时，需要考虑损失函数的哪些属性？,凸性、可微性、鲁棒性、光滑性、稀疏性、多模态、单调性、不变性。
常见的回归模型包括哪些？,线性回归、多项式回归和回归树等。
MSE损失函数具有哪些性质？,非负、二次、可微、凸性、尺度依赖。
MAE损失函数具有哪些性质？,非负、线性、鲁棒性、不可微、凸性、尺度效应。
IS与FID有什么不同？,FID考虑了生成图像的统计数据并将其与真实图像的统计数据进行比较。
为什么PSNR对于生成图像建模等任务来说，它并不是特别有效？,因为生成图像建模的目标是生成新的高质量图像，而不是简单地重建现有图像。
SSIM主要用于什么任务？,SSIM可用于图像生成任务，以比较生成的图像与目标（真实）图像。
对抗性损失基于什么？,它基于两个神经网络之间的极大极小博弈的思想。
重构损失函数的目的是什么？,为了保证VAE的解码器网络能够重建出尽可能接近原始图像的输入图像本质上，重建损失是将原始图像与重建图像进行比较。
SimSiam损失函数的主要目的是什么？,旨在通过推动同一图像的两个视图尽可能相似来学习表征。虽然它不是明确为人脸识别而设计的，但它可以用来学习人脸的有意义的表征。
SimSiam损失函数的优势有哪些？,无负对、停止梯度操作、简单性。
SimSiam损失函数的缺点有哪些？,超参数敏感性、依赖于数据增强、非语义特征
为什么知识问答数据库对垂类大模型很重要？,因为这能很好地满足客户的知识问答需求
Barlow Twins损失的关键思想是什么,使处理同一图像的两个不同视图的双孪生网络的输出尽可能相似，同时减少这些表示的维度之间的冗余。
在图像识别中，三重损失函数的背后思想是什么？,是训练模型区分正面的一对图像(同一个人的两张图像)和负面的一对图像(不同人的两张图像)。
在人脸识别中，A-Softmax损失函数怎样解决传统softmax损失函数的局限性？,通过考虑人脸图像特征与其相应标签之间的角度信息来解决传统 softmax损失的局限性。
图像分割方法主要分为哪三类？,语义分割、实例分割、全视分割。
中心损失函数的灵感来源是什么？,中心损失的灵感来自于特征空间中每个类都有一个中心的想法，损失函数鼓励同一类的特征靠近其中心。
人脸识别中使用的损失函数可以分为哪两类？,基于分类的损失函数和基于表示学习的损失函数
人脸识别的目的是什么？,将图像或视频中的个人面部与人脸数据库中的相应条目进行准确匹配。
用于分割的交联损失函数的目标是什么？,预测给定图像的逐像素分割掩码
常见的损失函数有哪些？,括交叉熵损失、交联损失、Focal损失、Dice损失、Tversky损失和Lovász损失。
Average Recall(平均召回)与Precision或Recall(在特定的决策阈值上定义)的不同在于哪里？,"Average Recall(平均召回)是通过在不同级别的交联(Intersectionover Union,IoU)阈值上平均召回值来计算的如果需要，还可以在每个图像的不同最大检测数下计算。"
YOLO损失函数是由哪三部分组成的多部分损失？,定位损失、信心损失、分类损失
