question,answer
新型多级管道生态系统有哪几部分？,元宇宙计算、网络、通信和硬件基础设施、环境数字化和用户交互三个部分。
元宇宙的发展趋势是什么？,更高的沉浸式体验、更多的虚拟商品和服务、更智能的环境、更好的隐私保护以及更多的跨平台互操作性。
什么是多级管道生态系统？,将数据流分成多个层次，以实现更好的管理和优化。
如何确保元宇宙的安全性？,通过加密、身份验证、访问控制等手段
如何提高元宇宙的可扩展性？,通过分布式计算、负载均衡、内容分发网络等手段
什么是边缘计算？,在离用户更近的地方处理数据和任务，以提高响应速度和减少延迟。
什么是Metaverse？,Metaverse是一个虚拟现实世界，它通过网络和计算机技术将现实世界的物理、经济、社交和娱乐活动转移到数字环境中。
什么是Metaverse Environment Digitization？,指将现实世界中的物理空间数字化，使其可以在Metaverse中进行模拟和交互。
什么是数字孪生技术？,指将现实世界中的实体复制到虚拟世界中，以便进行模拟和分析。
如何克服The Metaverse面临的挑战？,提高技术水平、改善用户体验、加强安全和隐私保护、制定相关法律和道德规范等。
虚拟商品在The Metaverse中有什么作用？,提供一种新的经济模式，允许用户购买、出售和交易虚拟商品，从而提高用户体验和经济收益。
什么是Metaverse Ecosystem？,指Metaverse中的各种组成部分和相关产业的集合体。它包括了Metaverse Computing、Environment Digitization、User Interactions等多个方面，以及相关的技术、服务、应用、平台等产业链。
如何评估Metaverse的价值？,经济价值、社会价值、文化价值等。
Metaverse的新颖管道生态系统有哪些？,区块链技术、去中心化金融（DeFi）、非同质化代币（NFT）、游戏和元宇宙等
Metaverse的技术基础包括哪些？,虚拟现实技术、增强现实技术、5G通信技术、云计算技术、区块链技术等。
Metaverse面临的主要挑战是什么？,技术问题、用户体验问题、安全和隐私问题、法律和道德问题等。
Metaverse的主要特点和功能是什么？,具有高度的互动性、可塑性和可持续性，可以提供更加真实的虚拟体验。其主要功能包括游戏、社交、商业和其他活动。
Metaverse的未来发展趋势和方向是什么？,更高的沉浸式体验、更多的虚拟商品和服务、更智能的环境、更好的隐私保护以及更多的跨平台互操作性。
Metaverse中的虚拟角色有什么作用？,为用户提供各种服务和支持，例如虚拟助手、虚拟导游、虚拟教练等。它们可以为用户提供个性化的体验和服务，帮助用户更好地融入Metaverse中。
Metaverse在商业领域有哪些应用？,虚拟品牌推广、虚拟产品展示、虚拟购物等。通过Metaverse，企业可以在一个真实的虚拟环境中进行营销和销售活动。
Metaverse在医疗保健领域有哪些应用？,虚拟现实疗法、虚拟模拟手术、虚拟康复训练等。
Metaverse对于社会的影响是什么？,能对社会产生积极的影响，例如创造就业机会、促进文化交流、提高教育水平等。但也可能存在一些负面影响，例如增加沉迷风险、加剧社会不平等等。
Metaverse的商业模式是什么？,虚拟商品销售、广告收入、会员制、订阅制等。
Metaverse的未来发展是否会对现有的社会结构产生影响？,可能会对现有的社会结构产生影响，例如可能会改变人们的社交方式、工作方式、消费习惯等。